<?xml version="1.0"?>
<!DOCTYPE signalml SYSTEM "SignalML_2_0.dtd">
<signalml>

  <header>
    <format_id><info>testfile for ifs</info></format_id>
    <url>http://wheredoyouwantogotoday.to</url>
  </header>

  <if id='if1' test='1'>
    <param id='p1' type='int'>
      <expr>333</expr>
    </param>
    <else>
      <param id='p1' type='str'>
	<expr>333</expr>
      </param>
    </else>
  </if>

  <param id='p2'>
    <expr>if1.p1 * 2</expr>
  </param>

  <param id='requires_builtin_strip'>
    <expr>strip('aaa ')</expr>
  </param>

  <param id='wrap_builtin_strip'>
    <arg name='s' type='str' />
    <expr>strip(s)</expr>
  </param>

  <param id='call_wrap_builtin_strip'>
    <expr>wrap_builtin_strip(' bbb ')</expr>
  </param>

  <param id='test_range_1'>
    <expr>range(30)</expr>
  </param>

  <param id='test_range_2'>
    <expr>range(3, 30)</expr>
  </param>

  <param id='test_range_3'>
    <expr>range(2, 30, 5)</expr>
  </param>
</signalml>
